"109","As we're a young business, we're still only two people working for it, but the demands from our main client often exceed our resources.",10.0287933349609,53.5843963623047,5,4,30,3.5,3,1,1,1.5,3,3.5,2.5,2.5,2.5,2.5,2.5,5,4,2.86666666666667,1,1,0.0548905432849644,2.16666666666667,3,4,3.83333333333333,5,3,2,2,6,2,4,4.66666666666667,214,4.33333333333333,NA,NA,NA,NA,NA,NA,NA,NA,NA,NA,NA,NA,NA,NA,NA,NA,NA,NA,NA,NA,NA,NA,NA,NA,NA,NA,NA,NA,NA,NA,NA,NA,NA,NA,NA,NA,NA,NA,NA,NA,NA,NA,NA,NA,NA,1119,4,2
"110","Employees or hard to recruit Work is produce not at a normal speed. Even if we allow over time (after 35 hours/week) employees do not accept to word more. Because we are not a essential service, we do not impose. We hope!",-73.5821990966797,45.5153961181641,5,4,56,2,3.5,2,1,1,2,1.5,1,2,3,1.5,2.5,5,4,2.53333333333333,1,1,0.307298135397137,2.33333333333333,3,5,4.33333333333333,4,5,2,4,6,3,3,4,731,4.33333333333333,NA,NA,NA,NA,NA,NA,NA,NA,NA,NA,NA,NA,NA,2.33333333333333,NA,0.18798786825614,2.33333333333333,NA,NA,2.625,NA,3.33333333333333,NA,NA,NA,NA,NA,NA,NA,NA,NA,NA,NA,NA,NA,NA,NA,NA,NA,NA,NA,NA,NA,NA,NA,1120,4,2
"111","Conflict with colleagues : not exacly a conflict because I didn't tell him. But after a discussion (and It happen several times) I had a feeling  that this personn had too much principles. And that hinders me from wanting to work with this personn.",-73.5821990966797,45.5153961181641,2,4,51,3.5,2,1.5,1,3.5,3,1.5,1,1,1.5,3,3,3,4,1.93333333333333,1,2,0.0779648912642437,1.66666666666667,3,5,3,3,1,2,3,3,1,7,3.33333333333333,700,1.66666666666667,2.5,2,1,1,1.5,1.5,3,3,3,2,3,2.5,4,1.22222222222222,1,0.004864543641292,1.5,6,3,1,2.33333333333333,1.66666666666667,NA,NA,NA,NA,NA,NA,NA,NA,NA,NA,NA,NA,NA,NA,NA,NA,NA,NA,NA,NA,NA,NA,NA,1121,3,2
"112","The Boss thinks that I’m not legally capable to do the job",13.4358978271484,52.4743041992188,4,4,23,2.5,4,2,3,2,3,3.5,2,3,3.5,3.5,3,4,3,3.13333333333333,1,1,-0.0300262176489016,2.16666666666667,3,4,3,1,3,2,4,6,2,3,3,396,3,NA,NA,NA,NA,NA,NA,NA,NA,NA,NA,NA,NA,NA,NA,NA,NA,NA,NA,NA,NA,NA,NA,NA,NA,NA,NA,NA,NA,NA,NA,NA,NA,NA,NA,NA,NA,NA,NA,NA,NA,NA,NA,NA,NA,NA,1122,3,2
"113","Artwork was supplied by client, it was supposed to be sent off to printer but it was not, now we may not meet the deadline.",-79.4195022583008,43.6643981933594,7,5,32,4,3.5,3,1,1,1,1,1,1,4,2,1,5,4,1.93333333333333,1,2,0.827444336838316,1.33333333333333,1,5,4.33333333333333,4,1,2,4,2,2,4,3.66666666666667,1218,2.66666666666667,NA,NA,NA,NA,NA,NA,NA,NA,NA,NA,NA,NA,NA,NA,NA,NA,NA,NA,NA,NA,NA,NA,NA,NA,NA,NA,NA,NA,NA,NA,NA,NA,NA,NA,NA,NA,NA,NA,NA,NA,NA,NA,NA,NA,NA,1123,4,1
"114","COVID 19",9.49099731445312,51.2993011474609,8,3,56,4,4,1,2,1,3,3.5,1,2,4,3.5,2,4,4,2.26666666666667,1,1,-1.32625038954179,2.16666666666667,3,4,3,1,1,1,4,3,1,2,4.33333333333333,-182,3.33333333333333,NA,NA,NA,NA,NA,NA,NA,NA,NA,NA,NA,NA,NA,NA,NA,NA,NA,NA,NA,NA,NA,NA,NA,NA,NA,NA,NA,NA,NA,NA,NA,NA,NA,NA,NA,NA,NA,NA,NA,NA,NA,NA,NA,NA,NA,1124,3,2
"115","Working too hard and wanting too much. It caused me to burn out and become sick.",5.91459655761719,51.9806976318359,8,5,20,2,4,4,2,1,1.5,4,1.5,3,3,4,2,5,4,2.8,1,2,0.434953083990992,1.66666666666667,2,1,4,2,5,1,5,5,3,3,4.66666666666667,183,3,NA,NA,NA,NA,NA,NA,NA,NA,NA,NA,NA,NA,NA,2.66666666666667,NA,NA,NA,NA,NA,NA,NA,5,NA,NA,NA,NA,NA,NA,NA,NA,NA,NA,NA,NA,NA,NA,NA,NA,NA,NA,NA,NA,NA,NA,NA,1125,4,2
"116","When ordering the outside packaging of one of our face mask products, the manufacturer had engraved a logo different to what we specified.",4.86599731445312,52.3639984130859,6,4,19,2,4,4,2,1.5,3,1.5,2,1.5,4,2.5,3,5,2,3.06666666666667,1,2,-0.300470217446528,3,1,7,3.66666666666667,1,3,2,5,5,4,4,4.33333333333333,183,2.33333333333333,NA,NA,NA,NA,NA,NA,NA,NA,NA,NA,NA,NA,NA,NA,NA,NA,NA,NA,NA,NA,NA,NA,NA,NA,NA,NA,NA,NA,NA,NA,NA,NA,NA,NA,NA,NA,NA,NA,NA,NA,NA,NA,NA,NA,NA,1126,4,3
"117","i had a screening of one of my short films, and the quality of the video was awful, therefore it was presented badly to the people watching it, which might have led to undermining my professional skills related to what i do.",27.9167022705078,43.2167053222656,6,5,24,4,1,1,1,1,1,3,4,2,2,1,1,1,4,1.6,1,1,0.612986023271713,1.16666666666667,3,3,2,2,1,1,3,2,1,3,3,274,2.33333333333333,NA,NA,NA,NA,NA,NA,NA,NA,NA,NA,NA,NA,NA,1.88888888888889,NA,0.268862211781512,1.83333333333333,NA,NA,2.875,NA,2.33333333333333,NA,NA,NA,NA,NA,NA,NA,NA,NA,NA,NA,NA,NA,NA,NA,NA,NA,NA,NA,NA,NA,NA,NA,1127,2,1
"118","We had to lay off a lot of people because of a new business direction. Consequently we lost our team culture and some of the people that we still kept we’re not really motivated anymore. The team you build is the company that you build. So was quite a tough challenge.",13.4102935791016,52.5520935058594,8,4,22,4,4,1.5,1,3,3,4,1,4,3.5,2.5,1.5,3,3,2.4,2,1,-0.708188959775117,2.16666666666667,3,4,3,1,2,2,5,1,2,7,4,914,3.66666666666667,NA,NA,NA,NA,NA,NA,NA,NA,NA,NA,NA,NA,NA,NA,NA,NA,NA,NA,NA,NA,NA,NA,NA,NA,NA,NA,NA,NA,NA,NA,NA,NA,NA,NA,NA,NA,NA,NA,NA,NA,NA,NA,NA,NA,NA,1128,3,2
"119","Because of COVID-19 some clients did not realize projects",11.5832977294922,48.1499938964844,1,5,61,3.5,2.5,1,2.5,2.5,3,4,2,3,3.5,3,2,4,6,1.13333333333333,1,1,0.84817599412817,1.33333333333333,3,3,3.16666666666667,5,2,2,4,2,4,3,3.66666666666667,639,1.33333333333333,NA,NA,NA,NA,NA,NA,NA,NA,NA,NA,NA,NA,NA,NA,NA,NA,NA,NA,NA,NA,NA,NA,NA,NA,NA,NA,NA,NA,NA,NA,NA,NA,NA,NA,NA,NA,NA,NA,NA,NA,NA,NA,NA,NA,NA,1130,3,1
"120","an assignment (speaking job) got cancelled last minute.",6.54960632324219,53.2053985595703,8,4,30,4,2,2,1,1,2,3,1.5,1,1.5,3,2,2,6,2.2,1,2,0.313154862120701,1.33333333333333,2,1,2.66666666666667,3,4,1,3,3,4,1,1.66666666666667,214,1.33333333333333,NA,NA,NA,NA,NA,NA,NA,NA,NA,NA,NA,NA,NA,1.44444444444444,NA,NA,NA,NA,NA,NA,NA,1,NA,NA,NA,NA,NA,NA,NA,NA,NA,NA,NA,NA,NA,NA,NA,NA,NA,NA,NA,NA,NA,NA,NA,1131,3,1
"121","COVID 2nd wave hit the Netherlands. It disrupted our ability to meet up with people physically and show up to places",6.56640625,53.2221984863281,8,5,24,3.5,3.5,1.5,1,1,1.5,2.5,1.5,3.5,3,3.5,1.5,4,4,2.46666666666667,1,1,-0.0171515597212814,1.5,3,1,3.66666666666667,2,1,3,5,5,3,3,2,183,2.33333333333333,NA,NA,NA,NA,NA,NA,NA,NA,NA,NA,NA,NA,NA,2.44444444444444,NA,NA,NA,NA,NA,NA,NA,1.66666666666667,NA,NA,NA,NA,NA,NA,NA,NA,NA,NA,NA,NA,NA,NA,NA,NA,NA,NA,NA,NA,NA,NA,NA,1132,4,2
"122","Corona made it slower",6.56640625,53.2221984863281,8,5,24,3.5,4,1.5,1,1,2.5,2,NA,1.5,3,3,1.5,2,4,3.2,1,1,0.845833303438744,1.33333333333333,3,1,2.66666666666667,2,1,2,4,6,NA,4,5,183,2,NA,NA,NA,NA,NA,NA,NA,NA,NA,NA,NA,NA,NA,NA,NA,NA,NA,NA,NA,NA,NA,NA,NA,NA,NA,NA,NA,NA,NA,NA,NA,NA,NA,NA,NA,NA,NA,NA,NA,NA,NA,NA,NA,NA,NA,1133,3,1
"123","We negotiated with a new service provider (logistics) and although our PoC was aware of the time pressure that we had, he was not replying in time and it was very hard for me to get my information.",11.5832977294922,48.1499938964844,6,5,39,2,3,1,1,1,2,1.5,1,1,3,2.5,1.5,4,4,2,1,1,0.991421131982484,1.5,3,4,4.33333333333333,4,1,2,5,3,5,2,2,973,2,NA,NA,NA,NA,NA,NA,NA,NA,NA,NA,NA,NA,NA,2.88888888888889,NA,1.09399323539677,1.16666666666667,NA,NA,3,NA,4.33333333333333,NA,NA,NA,NA,NA,NA,NA,NA,NA,NA,NA,NA,NA,NA,NA,NA,NA,NA,NA,NA,NA,NA,NA,1134,4,2
"124","Co-founders long absence due to becoming a father",7.47129821777344,51.4472961425781,5,2,32,3.5,2.5,1,1,1,1,3,3,2.5,2.5,1.5,2,5,5,3.53333333333333,1,1,-2.27648456346089,4,3,4,3.91666666666667,4,1,2,5,6,4,1,3.33333333333333,731,3.66666666666667,NA,NA,NA,NA,NA,NA,NA,NA,NA,NA,NA,NA,NA,NA,NA,NA,NA,NA,NA,NA,NA,NA,NA,NA,NA,NA,NA,NA,NA,NA,NA,NA,NA,NA,NA,NA,NA,NA,NA,NA,NA,NA,NA,NA,NA,1135,4,4
"125","A client requested last-minute changes to a project, which disrupted my schedule with my other projects, which caused delays, which inevitable cut into my free time.",33.3639068603516,35.1638031005859,2,4,23,1.5,3.5,1.5,1,1,4,2,2.5,1.5,2,3,1,3,2,1.6,1,1,0.0548905432849644,1.83333333333333,1,3,3.66666666666667,5,1,1,3,5,5,7,1.66666666666667,761,3.66666666666667,NA,NA,NA,NA,NA,NA,NA,NA,NA,NA,NA,NA,NA,NA,NA,NA,NA,NA,NA,NA,NA,NA,NA,NA,NA,NA,NA,NA,NA,NA,NA,NA,NA,NA,NA,NA,NA,NA,NA,NA,NA,NA,NA,NA,NA,1136,4,2
"126","Co-workers are employed and had little time to assist",8.59519958496094,50.0971069335938,5,4,24,2.5,3,1.5,1,1,2.5,3.5,1.5,1,3,1.5,1,4,4,2.2,1,2,-0.267206320279809,2.66666666666667,1,7,3.33333333333333,4,1,2,4,2,4,5,1,973,3.66666666666667,NA,NA,NA,NA,NA,NA,NA,NA,NA,NA,NA,NA,NA,NA,NA,NA,NA,NA,NA,NA,NA,NA,NA,NA,NA,NA,NA,NA,NA,NA,NA,NA,NA,NA,NA,NA,NA,NA,NA,NA,NA,NA,NA,NA,NA,1137,3,3
"127","Products were not cleared by customs",13.4096984863281,52.5451049804688,4,5,23,2.5,3,3.5,2,2.5,3,2.5,3.5,3,3,2.5,3,5,4,2.66666666666667,1,1,0.0220827327687888,2.5,3,4,4,4,1,2,3,3,4,4,3.33333333333333,-92,3.33333333333333,NA,NA,NA,NA,NA,NA,NA,NA,NA,NA,NA,NA,NA,NA,NA,NA,NA,NA,NA,NA,NA,NA,NA,NA,NA,NA,NA,NA,NA,NA,NA,NA,NA,NA,NA,NA,NA,NA,NA,NA,NA,NA,NA,NA,NA,1138,4,2
